Chocolate Covered Strawberries,"Everyone loves chocolate-covered fruit, right? Make your own chocolate-covered strawberries simply and quickly with this recipe."
Strawberry Spinach Salad I,This spinach and strawberry salad is topped with a fabulous homemade poppy seed dressing.
Supreme Strawberry Topping,Awesome restaurant-style strawberry topping. Serve cold over cheesecake or ice cream.
Strawberry Angel Food Dessert,"Angel food cake pieces are topped with sweetened cream cheese, whipped topping and strawberries in this chilled, layered dessert."
Judy's Strawberry Pretzel Salad,"This three-layer salad includes a pretzel crust, cream cheese center, and strawberry top."
Chocolate Covered Strawberries,"Everyone loves chocolate-covered fruit, right? Make your own chocolate-covered strawberries simply and quickly with this recipe."
